,ID,Title,Content,Time,Place
614,100116,In sich blätternder Hain,"In sich blätternder Hain,einzelnes menschliches Leben,kannst du es näher umgeben?kannst du ihm inniger seinals eine Liebende? Ach.Weinend durchwandelt dich einer-sei ihm befreundet, du reiner,sei ihm geneigter, gieb nach.",Winter 1913/14,ParisGedichte 1906 bis 1926.(Sammlung der verstreuten und nachgelassenen Gedichte aus den mittleren und späten Jahren.)
615,100117,Wo soll ich hin während in mir Berge stürzen,"Chor:Wo soll ich hinwährend in mirBerge stürzen,wo wart ich's ab,dass die entbetteten Flüsse,wieder verständigt,teilen die Landschaftin gelassene Ufer.Sind nicht in unszu gefährlichen ZeitenDinge aufgebäumt,an denen uns Anblickmüsste verwehrt sein.",Winter 1913/14,ParisGedichte 1906 bis 1926.(Sammlung der verstreuten und nachgelassenen Gedichte aus den mittleren und späten Jahren.)
616,100118,Ritter in der Hölle,"Sein Leben war.... wer sagte, was es war?ein türmisch Dastehn und ein Umsichschlagen[wider die nachgewachsene Gefahr;]ein Wüten, seinen Panzer abzugtragenund über Hunderte in allen LagenNiedergelegte wie ein Hungerjahrhinauszustehen.. . . . . . . . . . . . . . . . . . . . . Immer noch den Griff des Doppelhändersin der fäustigen Umklammerung,mit dem Wiegen eines Sechzehnendersseiner ungeheuren Helmzier Schwungtragend (trat er aus dem Unterholzseines Todes in die hohe Lichtung -alle Flamme schlug in seine Richtung)",Winter 1913/14,ParisGedichte 1906 bis 1926.(Sammlung der verstreuten und nachgelassenen Gedichte aus den mittleren und späten Jahren.)
617,100119,Wie der Abendwind,"Wie der Abendwind durch geschulterte Sensen der Schnittergeht der Engel lind durch die schuldlose Schneide der Leiden.Hält sich stundenlang zur Seite dem finsteren Reiter,hat den selben Gang wie die namenlosen Gefühle.Steht am Turm am Meer, zu dauern unendlich gesonnen;was du fühlst ist Er, im Innern der Härte geschmeidig,dass im Notgestein die gedrängte Druse der Tränen,lange wasserrein, sich entschlösse zu Amethysten.",Winter 1913/14,ParisInsel-Almanach (1928)
618,100120,Du im Voraus verlorne Geliebte,"Du im Vorausverlorne Geliebte, Nimmergekommene,nicht weiß ich, welche Töne dir lieb sind.Nicht mehr versuch ich, dich, wenn das Kommende wogt,zu erkennen. Alle die großenBilder in mir, im Fernen erfahrene Landschaft,Städte und Türme und Brücken und un-vermutete Wendungen der Wegeund das Gewaltige jener von Götterneinst durchwachsenen Länder:steigt zur Bedeutung in mirdeiner, Entgehende, an.Ach, die Gärten bist du,ach, ich sah sie mit solcherHoffnung. Ein offenes Fensterim Landhaus -, und du tratest beinahemir nachdenklich heran. Gassen fand ich, -du warst sie gerade gegangen,und die Spiegel manchmal der Läden der Händlerwaren noch schwindlich von dir und gaben erschrockenmein zu plötzliches Bild. - Wer weiß, ob derselbeVogel nicht hinklang durch unsgestern, einzeln, im Abend?",Winter 1913/14,ParisInselschiff (1926/27)
619,100121,Einst war dies alles anders aufgeteilt,"Einst war dies alles anders aufgeteilt:durch jeden Vorgang gingen wacheschauende Götter; Gott-Wind bog die schwachegöttliche Dryas, und in jedem Bachelag eine Nymphe, heiter übereilt.Und wenn der Hirt in seiner Traurigkeitdas Rohr, das er sich zu lange zugeschnitten,ansetzte -: oh wie wurde weit,was ihm an Klage ausging, mitgelitten.Nun fällt uns längst schon dieses alles zu:dahinzuweben mit dem Hingewehten,für einen Abend in den Baum zu tretenund in der Quelle tauschendem Getuder Geist zu sein, den ihre Wirbel drehten.Wir wurden mehr; wir wohnen in dem meisten,das ahnend ein Entgangenes entbehrt;doch: dass wir fast der Götter Leichtsein leisten,hat uns das dumpfe Menschliche erschwert.",5.1.1914,ParisGedichte 1906 bis 1926.(Sammlung der verstreuten und nachgelassenen Gedichte aus den mittleren und späten Jahren.)
620,100122,Die Große Nacht,"Oft anstaunt ich dich, stand an gestern begonnenem Fenster,stand und staunte dich an. Noch war mir die neueStadt wie verwehrt, und die unüberredete Landschaftfinsterte hin, als wäre ich nicht. Nicht gaben die nächstenDinge sich Müh, mir verständlich zu sein. An der Laternedrängte die Gasse herauf: ich sah, dass sie fremd war.Drüben - ein Zimmer, mitfühlbar, geklärt in der Lampe -,schon nahm ich teil; sie empfandens, schlossen die Läden.Stand. Und dann weinte ein Kind. Ich wusste die Mütterrings in den Häusern, was sie vermögen -, und wusstealles Weinens zugleich die untröstlichen Gründe.Oder es sang eine Stimme und reichte ein Stück weitaus der Erwartung heraus, oder es hustete untenvoller Vorwurf ein Alter, als ob sein Körper im Recht seiwilder die mildere Welt. Dann schlug eine Stunde -,aber ich zählte zu spät, sie fiel mir vorüber. -Wie ein Knabe, ein fremder, wenn man endlich ihn zulässt,doch den Ball nicht fängt und keines der Spielekann, die die andern so leicht an einander betreiben,dasteht und wegschaut, - wohin -?: stand ich plötzlich,dass du umgehst mit mir, spielest, begriff ich, erwachseneNacht, und staunte dich an. Wo die Türmezürnten, wo abgewendeten Schicksalseine Stadt mich umstand und nicht zu erratende Bergewider mich lagen, und im genäherten Umkreishungernde Fremdheit umzog das zufällige Flackernmeiner Gefühle -: da war es, du Hohe,keine Schande für dich, dass du mich kanntest. Dein Atemging über mich. Dein auf weite Ernste verteiltesLächeln trat in mich ein.",Januar 1914,ParisInsel-Almanach 1918
621,100123,Hinhalten will ich mich,"Hinhalten will ich mich. Wirke. Geh überso weit du vermöchtest. Hast du nicht Hirten das Antlitzgrößer geordnet, als selbst der Fürstinnen Schoßunaufhörlicher Könige Herkunft und künftige Kühnheitformten den krönlichen Ausdruck? Wenn die Galionenin dem staunenden Holz des stillhaltenden SchnitzwerksZübe empfangen des Meerraums, in den sie stumm drängend hinausstehn:o, wie sollte ein Fühlender nicht, der will, der sich aufreißt,unnachgiebige Nacht, endlich dir ähnlicher sein.",Januar 1914,ParisDas Inselschiff 8 (1927)
622,100124,"Zu der Zeichnung, John Keats im Tode darstellend","Zu der Zeichnung, John Keats im Tode darstellendNun reicht an's Antlitz dem gestillten Rühmerdie Ferne aus den offnen Horizonten:so fällt der Schmerz, den wir nicht fassen konnten,zurück an seinen dunklen Eigentümer.Und dies verharrt, so wie es, leidbetrachtend,sich bildete zum freiesten Gebilde,noch einen Augenblick, - in neuer Mildedas Werden selbst und den Verfall verachtend.Gesicht: o wessen? Nicht mehr dieser ebennoch einverstandenen Zusammenhänge.O Aug, das nicht das schönste mehr erzwängeder Dinge aus dem abgelehnten Leben.O Schwelle der Gesänge,o Jugendmund, für immer aufgegeben.Und nur der Stirne baut sich etwas dauerndhinüber aus verflüchtigten Bezügen,als strafte sie die müden Locken lügen,die sich an ihr ergeben, zärtlich trauernd.",27.1.1914,Band III (1927)
623,100125,Vom Zeichner dringend hingeballter Schatten...,"Vom Zeichner dringend hingeballter Schattenhinter das nur noch scheinende Gesicht:so kommt die Nacht dem reinen Stern zustatten.Da ist ein Ding, das alles unterbricht,wozu die Dinge sich verstanden hatten;denn, da es wurde, siehe: war es nicht.O langer Weg zum schuldlosen Verzicht.O Mühe zum ermächtigten Ermatten.",26. oder 27.1.1914,ParisGedichte 1906 bis 1926.(Sammlung der verstreuten und nachgelassenen Gedichte aus den mittleren und späten Jahren.)
624,100126,Seit den wunderbaren Schöpfungstagen,"Seit den wunderbaren Schöpfungstagenschläft der Gott: wir sind sein Schlaf,hingenommen, stumpf von ihm ertragenunter Sternen, die er übertraf.Unser Handeln stockt ihm in geballterschlafner Hand und kann nicht aus der Faust,und so haben seit dem Helden-Alterunsre dunklen Herzen ihn durchbraust.Manchmal rührt er sich von unsrer Qual,schmerzensähnlich zuckts durch seine Glieder,aber immer überwiegt ihn wiederseiner Welten heile Überzahl.",Januar 1914,ParisDas Inselschiff 17 (1936)
625,100127,Ach aus eines Engels Fühlung falle,"Ach aus eines Engels Fühlung falleSchein in dieses Meer auf einem Mond,drin meine Herz, stillringende Koralle,sein jüngsten Zweigungen bewohnt.Not, mir von unkenntlichem Verüberzugefügte, bleibt mir ungewiss,Strömung zögert, Strömung drängt hinüber,Tiefe wirkt und Hindernis.Aus dem starren fühllosen Alten drehnsich Geschöpfe, plötzlich auserlesen,und das ewig Stumme aller Wesenüberstürzt ein dröhnendes Geschehn.",Februar 1914,ParisCorona 10 (1943)
626,100128,Hebend die Blicke vom Buch,"Hebend die Blicke vom Buch, von den nahen zählbaren Zeilen,in die vollendete Nacht hinaus:o wie sich sternegemäß die gedrängten Gefühle verteilen,so als bände man auf,einen Bauernstrauß:Jugend der leichten und neigendes Schwanken der schwerenund der zärtlichen zögernder Bug -.Überall Lust zu Bezug und nirgends Begehren;Welt zu viel und Erde genug.",Februar 1914,ParisDas Inselschiff 8 (1927)
627,100129,Flutet mir in diese trübe Reise,"Flutet mir in diese trübe ReiseDeines Herzens warme Bahn entgegen?Nur noch Stunden und ich werde leisemeine Hände in die Deinen legen:o wie lange ruhten sie nicht aus.Kannst Du Dir denn denken, dass ich Jahreso: ein Fremder unter Fremden fahre?Und nun endlich nimmst Du mich nach Haus.Siehst du, selbst um das Gestirn zu schauen,brauchts ein kleines irdisches Beruhn,denn Vertrauen kommt nur aus Vertrauen,Alles Wohltun ist ein Wiedertun.Ach die Nacht verlangte nicht von mir.Doch wenn ich mich zu den Sternen kehrte,der Versehrte an das Unversehrte:Worauf stand ich? War ich hier?Ach wie Wind durchging ich die Gestäuche,jedem Haus entdrang ich wie ein Rauch,wo sich andre freuten in Gebräucheblieb ich strenge wie ein fremder Brauch.Meine Hände gingen schreckhaft einin der andern schicksalvolle Schließung;Alle, alle mehrte die Ergießung:und ich konnnte nur vergossen sein",26.2.1914,Magda von Hattingberg. Wien 1943.
628,100130,Oh wie fühl ich still zu dir hinüber,"Oh wie fühl ich still zu dir hinüber,oh wie gehen mir von deinem Bildsteigende Gefühle flutend über.Ungeheuer ist mein Herz gewillt.In dem Raume, den ich in mich schauteaus dem Weltraum und dem Wind am Meer,gehst du, unbegreifliche Vertraute,wie sein eigenstes Geschöpf umher.Nun erst schließ ich, ach nach wieviel Zeitenmeine Augen über mir; nun magkeine Sehnsucht mehr mich überschreiten;denn vollendeter wird Nacht und Tag.Schau ich aber leise auf, so heiltmir die Welt am milderen Gesichte -,oh wo war ja doch: dass ich verzichte,allen Engeln noch nicht mitgeteilt.",27.2.1914,1957.
629,100131,Oh wie schälst du mein Herz aus den Schalen des Elends,"Oh wie schälst du mein Herz aus den Schalen des Elends.Was verriet dir im schlechten Gehäus den erhaltenen Kern?Der süß wie Gestirn, weltsüß, mir im Inneren ansteht.Ach, da ich litt, befiel ihn ein schläferndes Wachstum,da mir das Leiden schweigend die Glieder zerbrachschlief mir im Herzen ein Herz, ein künftiges, schuldlos.Eines, oh sieh: noch weiß ich nicht welches, noch rat ichs,dieses vermutete Herz. Ihm galten die Sternedie ich dem trüberen gab. Oh sei ihm hinüberdurch meine bange Natur. Sei ihm verständigt. Erkenns.Rufs. Du Erstaunende, rufs. Stell ihm ein kleinesLächeln zunächst, dass es sich rührt von dem Schein;neig ihm dein schönes Gesicht: den Raum des Erwachensdass es sich wundert in Dir und sich des Morgens gewöhnt.",2. und 3.3.1914,1957.
630,100132,Dich zu fühlen,"Dich zu fühlen bin ich aus den leichtenKreisen meiner Fühlungen gestiegenund jetzt soll mich täglich im ErreichtenTrauer großer Nähe überwiegen,dieses hülflos menschliche Gewicht.",April 1914,ParisGedichte 1906 bis 1926.(Sammlung der verstreuten und nachgelassenen Gedichte aus den mittleren und späten Jahren.)
631,100133,Regenbogen,"Aus geducktem Wetterunterstandin die freien Klärungen zu dringen:Land war klar wie klare Flüssigkeit;jeder Hof fing an, sich zu besingen,so als wäre größtestes Vollbringenheimlich in geringen Dienst gereiht.Und dann wandten wir uns: siehe: vorRegenprunk verbrauchter Finsternissemit der Flutung jener Himmelsrissehingebognes Augentor.Drunter klarer noch das linke Land:ernst, in einem Vorgefühl von Abend,mundhaft schweigend, tief getrunken habend,und mit starken Blumen zugewandt.",16.4.1914,ChantillyGedichte 1906 bis 1926.(Sammlung der verstreuten und nachgelassenen Gedichte aus den mittleren und späten Jahren.)
632,100134,Hassend nach dem Augenmaß,Hassend nach dem Augenmaß. . . .,Frühsommer 1914,1957.
633,100135,Aus unvordenklichem Greis,"Aus unvordenklichem Greis,dem ein Bartstrom die entlegene Brust übertönt,hebt sich entschlossener (sei's)hebt sich der Stamm und gewöhntsich an Jahrhunderte; an",Frühsommer 1914,ParisGedichte 1906 bis 1926.(Sammlung der verstreuten und nachgelassenen Gedichte aus den mittleren und späten Jahren.)
634,100136,Siehe das leichte Insekt,"Siehe das leichte Insekt, wie es spielt, nie entriet esdem geborgenen Schoß.Die es, entworfen, empfing, trug es aus und erträgtsdie Natur, und im gleichenMutter-Raum treibt es und westseine innige Zeit, hüpfend im freudigenLeib wie der kleine Johannes.Schon das säugende Tier im erweiterten Augstaunt",Frühsommer 1914,ParisGedichte 1906 bis 1926.(Sammlung der verstreuten und nachgelassenen Gedichte aus den mittleren und späten Jahren.)
635,100137,"Waldteich, weicher, in sich eingekehrter","Waldteich, weicher, in sich eingekehrter -,draußen ringt das ganze Meer und braust,aufgeregte Fernen drücken Schwerterjedem Sturmstoß in die Faust -,während du aus dunkler unversehrterTiefe     Spiele der Libellen schaust.Was dort jenseits eingebeugter BäumeÜberstürzung ist und Drang und Schwung,spiegelt sich in deine Innenräumeals verhaltene Verdüsterung;ungebogen steht um dich der Waldvoll von steigendem Verschweigen.Oben nur, im Wipfel-Ausblick, zeigenWolken sagenhafte Kampfgestalt.Dann: im teilnahmslosen Zimmer sein,einer sein, der beides weiß.O der Kerze kleiner Kreis,und die Menschennacht bricht einund vielleicht ein Schmerz im Körper innen.Soll ich mich des Sturmmeeres jetzt entsinnenoder Bild des Teichs in mir behütenoder, weil mir beide gleich entrinnen,Blüten denken -, jenes Garten Blüten -?Ach wer kennt, was in ihm überwiegt.Mildheit, Schrecken? Blicke, Stimmen, Bücher?Und das alles nur wie stille TücherSchultern einer Kindheit angeschmiegt,welche schläft in dieses Lebens Wirrn.Dass mich eines ganz ergreifen möge.Schauernd berg ich meine Stirn,denn ich weiß: die Liebe überwöge.Wo ist einer, der sie kann?      Wenn ich innig mich zusammenfasstevor die unvereinlichsten Kontraste:weiter kam ich nicht: ich schaute an;blieb das Angeschaute sich entziehend,schaut ich unbedingter, schaute knieend,bis ich es in mich gewann.Fand es in mir Liebe vor?Tröstung für das aufgegebne Freie,wenn es sich aus seiner Weltenreihewie mit unterdrücktem Schreiein den ungekannten Geist verlor?Hab ich das Errungene gekränkt,nichts bedenkend, als wie ich mirs finge,und die großgewohnten Dingeim gedrängten Herzen eingeschränkt?Fasst ich sie wie dieses Zimmer mich,dieses fremde Zimmer mich und meineSeele fasst?             O hab ich keine Hainein der Brust? kein Wehen? keineStille, atemleicht und frühlinglich?Bilder, Zeichen, dringend aufgelesen,hat es euch, in mir zu sein, gereut? -. . . . . . . . . . . . . . . . . . . . . . . . . . . . . . . . . . . . . . . Oh, ich habe zu der Welt kein Wesen,wenn sich nicht da draußen die Erscheinung,wie in leichter vorgefasster Meinung,weither heiter in mich freut. ",19./20.6.1914,ParisSpäte Gedichte. Leipzig 1934.
636,100138,Wendung,"Der Weg von der Innigkeit zur Größegeht durch das Opfer.                        KassnerLange errang ers im Anschaun.Sterne brachen ins Knieunter dem ringenden Aufblick.Oder er anschaute es knieend,und seines Instands Duftmachte ein Göttliches müd,dass es ihm lächelte schlafend.Türme schaute er so,dass sie erschraken:wieder sie bauend, hinan, plötzlich, in Einem!Aber wie oft, die vom Tagüberladene Landschaftruhete hin in sein stilles Gewahren, abends.Tiere traten getrostin den offenen Blick, weidende,und gefangenen Löwenstarrten hinein wie in unbegreifliche Freiheit;Vögel durchflogen ihn grad,den gemütigen; Blumenwiederschauten in ihn groß wie Kinder.Und das Gerücht, dass ein Schauender sei,rührte die minder,fraglicher Sichtbaren,rührte die Frauen.Schauend wie lang?Seit wie lange schon innig entbehrend,flehend im Grunde des Blicks?Wenn er, ein Wartender, saß in der Fremde; des Gasthofszerstreutes, abgewendetes Zimmermürrisch um sich, und im vermiedenen Spiegelwieder das Zimmerund später vom quälenden Bett auswieder:da beriets in der Luft,unfassbar beriet esüber sein fühlbares Herz,über sein durch den schmerzhaft verschütteten Körperdennoch fühlbares Herzberiet es und richtete:dass es der Liebe nicht habe.(Und verwehrte ihm weitere Weihen.)Denn des Anschauns, siehe, ist eine Grenze.Und die geschaute Weltwill in der Liebe gedeihn.Werk des Gesichts ist getan,tue nun Herz-Werkan den Bildern in dir, jenen gefangenen; denn duüberwältigtest sie: aber nun kennst du sie nicht.Siehe, innerer Mann, dein inneres Mädchen,dieses errungene austausend Naturen, dieseserst nur errungene, nienoch geliebte Geschöpf.",20.6.1914,Band III (1927)
637,100139,Klage,"Wem willst du klagen, Herz? Immer gemiedenerringt sich dein Weg durch die unbegreiflichenMenschen. Mehr noch vergebens vielleicht,da er die Richtung behält,Richtung zur Zukunft behält,zu der verlorenen.Früher. Klagtest? Was wars? Eine gefalleneBeere des Jubels, unreife.Jetzt aber bricht mir mein Jubel-Baum,bricht mir im Sturme mein langsamerJubel-Baum.Schönster in meiner unsichtbarenLandschaft, der du mich kenntlichermachtest Engeln, unsichtbaren.",Anfang Juli 1914,ParisInsel-Almanach (1927)
638,100140,Man muss sterben weil man sie kennt,"""Man muss sterben weil man sie kennt""(""Papyrus Prisse"". Aus den Sprüchen des Ptah-hotep, Handschrift um 2000 v. Ch.)""Man muss sterben weil man sie kennt."" Sterbenan der unsäglichen Blüte des Lächelns. Sterbenan ihren leichten Händen. Sterbenan Frauen.Singe der Jüngling die tödlichen,wenn sie ihm hoch durch den Herzraumwandeln. Aus seiner blühenden Brustsing er sie an:unerreichbare! Ach, wie sie fremd sind.Über den Gipfelnseines Gefühls gehn sie hervor und ergießensüß verwandelte Nacht ins verlasseneTal seiner Arme. Es rauschtWind ihres Aufgangs im Laub seines Leibes. Es glänzenseine Bäche dahin.Aber der Mannschweige erschütterter. Er, derpfadlos die Nacht im Gebirgseiner Gefühle geirrt hat:schweige.Wie der Seemann schweigt, der ältere,und die bestandenenSchrecken spielen in ihm wie in zitternden Käfigen.",Juli 1914,1.Buch (1918)
639,100141,Heute will ich dir zu Liebe Rosen fühlen,"Heute will ich dir zu Liebe Rosenfühlen, Rosen fühlen dir zu Liebe,dir zu Liebe heute lange langenicht gefühlte Rosen fühlen: Rosen.Alle Schalen sind gefüllt; sie liegenin sich selber, jede hundert Male, -wie von Talen angefüllte Taleliegen sie in sich und überwiegen.So unsäglich wie die Nachtüberwiegen sie den Hingegebnen,wie die Sterne über Ebnenüberstürzen sie mit Pracht.Rosennacht, Rosennacht.Nacht aus Rosen, Nacht aus vielen vielenhellen Rosen, helle Nacht aus Rosen,Schlaf der tausend Rosenaugenlider:heller Rosen-Schlaf, ich bin dein Schläfer.Heller Schläfer deiner Düfte; tieferSchläfer deiner kühlen Innigkeiten.Wie ich mich dir schwindend überlieferhast du jetzt mein Wesen zu bestreiten;sei mein Schicksal aufgelöstin das unbegreifliche Beruhen,und der Trieb, sich aufzutuen,wirke, der sich nirgends stößt.Rosenraum, geboren in den Rosen,in den Rosen heimlich auferzogen,und aus offnen Rosen zugegebengroß wie Herzraum: dass wir auch nach draußenfühlen dürfen in dem Raum der Rosen.",Juli 1914,ParisInsel Almanach 1953
640,100142,Gewitter Gewitter,"was willst du hier, wo der Nöte so viele sind und der Verhängnisse und der unbegreiflichen Wesen?was über diesem Haus, in dem wir doch vor dem eigenen Leben nicht sicher sind, in dem wir wohnen wie Flüchtlinge mit der Flucht zusammen, die mit hereingekommen ist?was über uns, die wir müde sind und unsern Mut draußen gelassen haben in den geängsteten Feldern?... was willst du von den Bäumen, die älter sind, als der Älteste unter uns? Hast du einen Auftrag an den Staub dessen, der sie gepflanzt hat? Und den Alten hier was unterbrichst du ihn in seinem unaufhörlichen Andenken? - Und wir, Rührigen, wir sitzen stumpf da und halten unsere Kraft wie Blei in den Schultern und haben nichts zu tun, solange du handelst. Und die Kinder sind aufgewacht und wundern sich, und es ist ein Zorn in der Luft, den ihnen die Mutter nicht ganz ausreden kann. Sie drückt die kleinen Gesichter in ihren Schoß eins nach dem andern, aber jedes Gesicht weiß und ist nicht wieder gut zu machen.Gewitter Gewitter, was willst du hier, wo schon alles ist, du Überfluss? Das Leben ist hier, und in den Zwischenräumen ist der Tod; Schmerzen sind da von allen Größen und ein bisschen Freudesamen irgendwo in einer Lade. Es ist alles vollzählig, kann ich dir versichern, auch das Zerbrochene, auch die Asche im Herd, auch die Kartoffelschalen. Und das Krachen im Holz und die Finsternis unter der Treppe und alles, was nur hereingeht.Lass doch die Mächte zu den Mächten kommen, ewiger Gott, nicht über uns.Gewitter, Gewitter, geh zur Jungfrau Maria (kennst du sie nicht?), mach dich so stark wie du magst, sie wird dich lieb haben, denn sie ist stärker als du. Sie wird mit dir spielen und nicht merken, dass du furchbar bist: denn sie ist stärker als du. Sie wird dich in die Hand nehmen wie eine große Hummel und sich stechen lassen von dir, und es wird kein Schmerz werden in ihrer Hand, sondern Wohltun in deinem Stachel . . . . .",2.7.1914,Leipzig 1933.
641,100143,"Wo wir uns hier, in einander drängend","Wo wir uns hier, in einander drängend, nichtnie finden: beginnen die Engelsich zu gewahren, und durch die tiefere Nähin heiligem Eilschritt wandeln sie endlos sich an.",Juli 1914,ParisGedichte 1906 bis 1926.(Sammlung der verstreuten und nachgelassenen Gedichte aus den mittleren und späten Jahren.)
