,ID,Title,Content,Time,Place
246,06a014,Der Schutzengel,"Du bist der Vogel, dessen Flügel kamen, wenn ich erwachte in der Nacht und rief. Nur mit den Armen rief ich, denn dein Namen ist wie ein Abgrund, tausend Nächte tief. Du bist der Schatten, drin ich still entschlief, und jeden Traum ersinnt in mir dein Samen, - du bist das Bild, ich aber bin der Rahmen, der dich ergänzt in glänzendem Relief. Wie nenn ich dich? Sieh, meine Lippen lahmen. Du bist der Anfang, der sich groß ergießt, ich bin das langsame und bange Amen, das deine Schönheit scheu beschließt. Du hast mich oft aus dunklem Ruhn gerissen, wenn mir das Schlafen wie ein Grab erschien und wie Verlorengehen und Entfliehn, - da hobst du mich aus Herzensfinsternissen und wolltest mich auf allen Türmen hissen wie Scharlachfahnen und wie Draperien. Du: der von Wundern redet wie vom Wissen und von den Menschen wie von Melodien und von den Rosen: von Ereignissen, die flammend sich in deinem Blick vollziehn, - du Seliger, wann nennst du einmal Ihn, aus dessen siebentem und letztem Tage noch immer Glanz auf deinem Flügelschlage verloren liegt... Befiehlst du, dass ich frage? ",24.7.1899,Berlin-Schmargendorf
247,06a015,Martyrinnen,"Martyrin ist sie. Und als harten Falls mit einem Ruck das Beil durch ihre kurze Jugend ging, da legte sich der feine rote Ring um ihren Hals, und war der erste Schmuck, den sie mit einem fremden Lächeln nahm; aber auch den erträgt sie nur mit Scham. Und wenn sie schläft, muss ihre junge Schwester (die, kindisch noch, sich mit der Wunde schmückt von jenem Stein, der ihr die Stirn erdrückt) die harten Arme um den Hals ihr halten, und oft im Traume fleht die andre: Fester, fester. Und da fällt es dem Kinde manchmal ein, die Stirne mit dem Bild von jenem Stein zu bergen in des sanften Nachtgewandes Falten, das von der Schwester Atmen hell sich hebt, voll wie ein Segel, das vom Winde lebt. Das ist die Stunde, da sie heilig sind, die stille Jungfrau und das blasse Kind. Da sind sie wieder wie vor allem Leide und schlafen arm und haben keinen Ruhm, und ihre Seelen sind wie weiße Seide, und von derselben Sehnsucht beben beide und fürchten sich vor ihrem Heldentum. Und du kannst meinen: wenn sie aus den Betten aufstünden bei dem nächsten Morgenlichte und, mit demselben träumenden Gesichte, die Gassen kämen in den kleinen Städten, - es bliebe keiner hinter ihnen staunen, kein Fenster klirrte an den Häuserreihn, und nirgends bei den Frauen ging ein Raunen, und keines von den Kindern würde schrein. Sie schritten durch die Stille in den Hemden (die flachen Falten geben keinen Glanz) so fremd, und dennoch keinem zum Befremden, so wie zu Festen, aber ohne Kranz. ",22.7.1899,Berlin-Schmargendorf
248,06a016,Die Heilige ,"Das Volk war durstig; also ging das eine durstlose Mädchen, ging die Steine um Wasser flehen für ein ganzes Volk. Doch ohne Zeichen blieb der Zweig der Weide, und sie ermattete am langen Gehn und dachte endlich nur, dass einer leide, (ein kranker Knabe, und sie hatten beide sich einmal abends ahnend angesehn). Da neigte sich die junge Weidenrute in ihren Händen dürstend wie ein Tier: jetzt ging sie blühend über ihrem Blute, und rauschend ging ihr Blut tief unter ihr. ",1.11.1902,Paris
249,06a017,Kindheit ,"Da rinnt der Schule lange Angst und Zeit mit Warten hin, mit lauter dumpfen Dingen. O Einsamkeit, o schweres Zeitverbringen... Und dann hinaus: die Straßen sprühn und klingen und auf den Plätzen die Fontänen springen und in den Gärten wird die Welt so weit -. Und durch das alles gehn im kleinen Kleid, ganz anders als die andern gehn und gingen -: O wunderliche Zeit, o Zeitverbringen, o Einsamkeit. Und in das alles fern hinauszuschauen: Männer und Frauen; Männer, Männer, Frauen und Kinder, welche anders sind und bunt; und da ein Haus und dann und wann ein Hund und Schrecken lautlos wechselnd mit Vertrauen -: O Trauer ohne Sinn, o Traum, o Grauen, o Tiefe ohne Grund. Und so zu spielen: Ball und Ring und Reifen in einem Garten, welcher sanft verblasst, und manchmal die Erwachsenen zu streifen, blind und verwildert in des Haschens Hast, aber am Abend still, mit kleinen steifen Schritten nachhaus zu gehn, fest angefasst -: O immer mehr entweichendes Begreifen, o Angst, o Last. Und stundenlang am großen grauen Teiche mit einem kleinen Segelschiff zu knien; es zu vergessen, weil noch andre, gleiche und schönere Segel durch die Ringe ziehn, und denken müssen an das kleine bleiche Gesicht, das sinkend aus dem Teiche schien -: O Kindheit, o entgleitende Vergleiche. Wohin? Wohin? ",Winter 1905/06,Paris (Meudon)
250,06a018,Aus einer Kindheit,"Das Dunkeln war wie Reichtum in dem Raume, darin der Knabe, sehr verheimlicht, saß. Und als die Mutter eintrat wie im Traume, erzitterte im stillen Schrank ein Glas. Sie fühlte, wie das Zimmer sie verriet, und küsste ihren Knaben: Bist du hier?... Dann schauten beide bang nach dem Klavier, denn manchen Abend hatte sie ein Lied, darin das Kind sich seltsam tief verfing. Es saß sehr still. Sein großes Schauen hing an ihrer Hand, die ganz gebeugt vom Ringe, als ob sie schwer in Schneewehn ginge, über die weißen Tasten ging. ",21.3.1900,Berlin-Schmargendorf
251,06a019,Der Knabe,"Ich möchte einer werden so wie die, die durch die Nacht mit wilden Pferden fahren, mit Fackeln, die gleich aufgegangenen Haaren in ihres Jagens großem Winde wehn. Vorn möcht ich stehen wie in einem Kahne, groß und wie eine Fahne aufgerollt. Dunkel, aber mit einem Helm von Gold, der unruhig glänzt. Und hinter mir gereiht zehn Männer aus derselben Dunkelheit mit Helmen, die wie meiner unstet sind, bald klar wie Glas, bald dunkel, alt und blind. Und einer steht bei mir und bläst uns Raum mit der Trompete, welche blitzt und schreit, und bläst uns eine schwarze Einsamkeit, durch die wir rasen wie ein rascher Traum: die Häuser fallen hinter uns ins Knie, die Gassen biegen sich uns schief entgegen, die Plätze weichen aus: wir fassen sie, und unsre Rosse rauschen wie ein Regen. ",Winter 1902/03,Paris
252,06a020,Die Konfirmanden,"In weißen Schleiern gehn die Konfirmandentief in das neue Grün der Gärten ein.Sie haben ihre Kindheit überstanden,und was jetzt kommt, wird anders sein.O kommt es denn! Beginnt jetzt nicht die Pause,das Warten auf den nächsten Stundenschlag?Das Fest ist aus, und es wird laut im Hause,und trauriger vergeht der Nachmittag...Das war ein Aufstehn zu dem weißen Kleideund dann durch Gassen ein geschmücktes Gehnund eine Kirche, innen kühl wie Seide,und lange Kerzen waren wie Alleen,und alle Lichter schienen wie Geschmeide,von feierlichen Augen angesehn.Und es war still, als der Gesang begann:Wie Wolken stieg er in der Wölbung anund wurde hell im Niederfall; und linderdenn Regen fiel er in die weißen Kinder.Und wie im Wind bewegt sich ihr Weiß,und wurde leise bunt in seinen Faltenund schien verborgne Blumen zu enthalten -:Blumen und Vögel, Sterne und Gestaltenaus einem alten fernen Sagenkreis.Und draußen war ein Tag aus Blau und Grünmit einem Ruf von Rot an hellen Stellen.Der Teich entfernte sich in kleinen Wellen,und mit dem Winde kam ein fernes Blühnund sang von Gärten draußen vor der Stadt.Es war, als ob die Dinge sich bekränzten,sie standen licht, unendlich leicht besonnt;ein Fühlen war in jeder Häuserfront,und viele Fenster gingen auf und glänzten.",Mai 1903,Paris
253,06a021,Das Abendmahl,"Sie sind versammelt, staunende Verstörte, um ihn, der wie ein Weiser sich beschließt und der sich fortnimmt denen er gehörte und der an ihnen fremd vorüberfließt. Die alte Einsamkeit kommt über ihn, die ihn erzog zu seinem tiefen Handeln; nun wird er wieder durch den Wald wandeln, und die ihn lieben werden vor ihm fliehn. Er hat sie zu dem letzten Tisch entboten und (wie ein Schuß die Vögel aus den Schoten scheucht) scheucht er ihre Hände aus den Broten mit seinem Wort: sie fliegen zu ihm her;sie flattern bange durch die Tafelrundeund suchen einen Ausgang. Aber erist überall wie eine Dämmerstunde. ",19.6.1903,Paris
254,06b001,Initiale,"Aus unendlichen Sehnsüchten steigen endliche Taten wie schwache Fontänen, die sich zeitig und zitternd neigen. Aber, die sich uns sonst verschweigen, unsere fröhlichen Kräfte - zeigen sich in diesen tanzenden Tränen. ",20.7.1899,Berlin-Schmargendorf
255,06b002,Zum Einschlafen zu sagen,"Ich möchte jemanden einsingen, bei jemandem sitzen und sein. Ich möchte dich wiegen und kleinsingen und begleiten schlafaus und schlafein. Ich möchte der Einzige sein im Haus, der wüsste: die Nacht war kalt. Und möchte horchen herein und hinaus in dich, in die Welt, in den Wald. Die Uhren rufen sich schlagend an, und man sieht der Zeit auf den Grund. Und unten geht noch ein fremder Mann und stört einen fremden Hund. Dahinter wird Stille. Ich habe groß die Augen auf dich gelegt; und sie halten dich sanft und lassen dich los, wenn ein Ding sich im Dunkel bewegt. ",14.11.1900,Berlin-Schmargendorf
256,06b003,Menschen bei Nacht,"Die Nächte sind nicht für die Menge gemacht. Von deinem Nachbar trennt dich die Nacht, und du sollst ihn nicht suchen trotzdem. Und machst du nachts deine Stube licht, um Menschen zu schauen ins Angesicht, so musst du bedenken: wem. Die Menschen sind furchtbar vom Licht entstellt, das von ihren Gesichtern träuft, und haben sie nachts sich zusammengesellt, so schaust du eine wankende Welt durcheinandergehäuft. Auf ihren Stirnen hat gelber Schein alle Gedanken verdrängt, in ihren Blicken flackert der Wein, an ihren Händen hängt die schwere Gebärde, mit der sie sich bei ihren Gesprächen verstehn; und dabei sagen sie: Ich und Ich und meinen: Irgendwen. ",25.11.1899,Berlin-Schmargendorf
257,06b004,Der Nachbar,"Fremde Geige, gehst du mir nach?In wieviel Städten schon sprachdeine einsame Nacht zu meiner?Spielen dich hunderte? Spielt dich einer?Giebt es in allen großen Städtensolche, die sich ohne dichschon in den den Flüssen verloren hätten?Und warum trifft es immer mich?Warum bin ich immer der Nachbar derer,die ich bange zwingend zu singenund zu sagen: Das Leben ist schwererals die Schwere von allen Dingen.",1902/03,Paris
258,06b005,Pont du Carrousel,"Der blinde Mann, der auf der Brücke steht, grau wie ein Markstein namenloser Reiche, er ist vielleicht das Ding, das immer gleiche, um das von fern die Sternenstunde geht, und der Gestirne stiller Mittelpunkt. Denn alles um ihn irrt und rinnt und prunkt. Er ist der unbewegliche Gerechte in viele wirre Wege hingestellt; der dunkle Eingang in die Unterwelt bei einem oberflächlichen Geschlechte. ",1902/03,Parisf
259,06b006,Der Einsame,"Wie einer, der auf fremden Meeren fuhr, so bin ich bei den ewig Einheimischen; die vollen Tage stehn auf ihren Tischen, mir aber ist die Ferne voll Figur. In mein Gesicht reicht eine Welt herein, die vielleicht unbewohnt ist wie ein Mond, sie aber lassen kein Gefühl allein, und alle ihre Worte sind bewohnt. Die Dinge, die ich weither mit mir nahm, sehn selten aus, gehalten an das Ihre -: in ihrer großen Heimat sind sie Tiere, hier halten sie den Atem an vor Scham. ",2.4.1903,Viareggio
260,06b007,Die Aschanti ,"(Jardin d'Acclimatation) Keine Vision von fremden Ländern, kein Gefühl von braunen Frauen, die tanzen aus den fallenden Gewändern. Keine wilde fremde Melodie. Keine Lieder, die vom Blute stammten, und kein Blut, das aus den Tiefen schrie. Keine braunen Mädchen, die sich samten breiteten in Tropenmüdigkeit; keine Augen, die wie Waffen flammten, und die Munde zum Gelächter breit. Und ein wunderliches Sich-verstehen mit der hellen Menschen Eitelkeit. Und mir war so bange hinzusehen. O wie sind die Tiere so viel treuer, die in Gittern auf und niedergehn, ohne Eintracht mit dem Treiben neuer fremder Dinge, die sie nicht verstehn; und sie brennen wie ein stilles Feuer leise aus und sinken in sich ein, teilnahmslos dem neuen Abenteuer und mit ihrem großen Blut allein. ",1902/03,Parisf
261,06b008,Der Letzte,"Ich habe kein Vaterhaus, und habe auch keines verloren; meine Mutter hat mich in die Welt hinaus geboren. Da steh ich nun in der Welt und geh in die Welt immer tiefer hinein, und habe mein Glück und habe mein Weh und habe jedes allein. Und bin doch manch eines Erbe. Mit drei Zweigen hat mein Geschlecht geblüht auf sieben Schlössern im Wald, und wurde seines Wappens müd und war schon viel zu alt; - und was sie mir ließen und was ich erwerbe zum alten Besitze, ist heimatlos. In meinen Händen, in meinem Schoß muss ich es halten, bis ich sterbe. Denn was ich fortstelle, hinein in die Welt, fällt, ist wie auf eine Welle gestellt. ",15.11.1900,Berlin-Schmargendorf
262,06b009,Bangnis,"Im welken Walde ist ein Vogelruf, der sinnlos scheint in diesem welken Walde. Und dennoch ruht der runde Vogelruf in dieser Weile, die ihn schuf, breit wie ein Himmel auf dem welken Walde. Gefügig räumt sich alles in den Schrei: Das ganze Land scheint lautlos drin zu liegen, der große Wind scheint sich hineinzuschmiegen, und die Minute, welche weiter will, ist bleich und still, als ob sie Dinge wüsste, an denen jeder sterben müsste, aus ihm herausgestiegen. ",kurz vor dem 21.10.1900,Berlin-Schmargendorf
263,06b010,Klage,"O wie ist alles fern und lange vergangen. Ich glaube, der Stern, von welchem ich Glanz empfange, ist seit Jahrtausenden tot. Ich glaube, im Boot, das vorüberfuhr, hörte ich etwas Banges sagen. Im Hause hat eine Uhr geschlagen... In welchem Haus?... Ich möchte aus meinem Herzen hinaus unter den großen Himmel treten. Ich möchte beten. Und einer von allen Sternen müsste wirklich noch sein. Ich glaube, ich wüsste, welcher allein gedauert hat, - welcher wie eine weiße Stadt am Ende des Strahls in den Himmeln steht... ",21.10.1900,Berlin-Schmargendorf
264,06b011,Einsamkeit,"Die Einsamkeit ist wie ein Regen. Sie steigt vom Meer den Abenden entgegen; von Ebenen, die fern sind und entlegen, geht sie zum Himmel, der sie immer hat. Und erst vom Himmel fällt sie auf die Stadt. Regnet hernieder in den Zwitterstunden, wenn sich nach Morgen wenden alle Gassen und wenn die Leiber, welche nichts gefunden, enttäuscht und traurig von einander lassen; und wenn die Menschen, die einander hassen, in einem Bett zusammen schlafen müssen: dann geht die Einsamkeit mit den Flüssen... ",21.9.1902,Paris
265,06b012,Herbsttag,"Herr, es ist Zeit. Der Sommer war sehr groß.Leg deinen Schatten auf die Sonnenuhren,und auf den Fluren lass die Winde los. Befiehl den letzten Früchten, voll zu sein;gib ihnen noch zwei südlichere Tage,dränge sie zur Vollendung hin, und jagedie letzte Süße in den schweren Wein. Wer jetzt kein Haus hat, baut sich keines mehr.Wer jetzt allein ist, wird es lange bleiben,wird wachen, lesen, lange Briefe schreibenund wird in den Alleen hin und herunruhig wandern, wenn die Blätter treiben.  ",21.9.1902,Paris
266,06b013,Erinnerung,"Und du wartest, erwartest das Eine, das dein Leben unendlich vermehrt; das Mächtige, Ungemeine, das Erwachen der Steine, Tiefen, dir zugekehrt. Es dämmern im Bücherständer die Bände in Gold und Braun; und du denkst an durchfahrene Länder, an Bilder, an die Gewänder wiederverlorener Fraun. Und da weißt du auf einmal: das war es. Du erhebst dich, und vor dir steht eines vergangenen Jahres Angst und Gestalt und Gebet. ",zwischen 1902-06,?
267,06b014,Ende des Herbstes ,"Ich sehe seit einer Zeit, wie alles sich verwandelt. Etwas steht auf und handelt und tötet und tut Leid. Von Mal zu Mal sind all die Gärten nicht dieselben; von den gilbenden zu der gelben langsamem Verfall: wie war der Weg mir weit. Jetzt bin ich bei den leeren und schaue durch alle Alleen. Fast bis zu den fernen Meeren kann ich den ernsten schweren verwehrenden Himmel sehn. ",zwischen 1902-06,?
268,06b015,Herbst,"Die Blätter fallen, fallen wie von weit, als welkten in den Himmeln ferne Gärten; sie fallen mit verneinender Gebärde. Und in den Nächten fällt die schwere Erde aus allen Sternen in die Einsamkeit. Wir alle fallen. Diese Hand da fällt. Und sieh dir andre an: es ist in allen. Und doch ist Einer, welcher dieses Fallen unendlich sanft in seinen Händen hält. ",11.9.1902,Paris
269,06b016,Am Rande der Nacht,"Meine Stube und diese Weite, wach über nachbetendem Land, - ist Eines. Ich bin eine Saite, über rauschende breite Resonanzen gespannt. Die Dinge sind Geigenleiber, von murrendem Dunkel voll; drin träumt das Weinen der Weiber, drin rührt sich im Schlafe der Groll ganzer Geschlechter..... Ich soll silbern erzittern: dann wird Alles unter mir leben, und was in den Dingen irrt, wird nach dem Lichte streben, das von meinem tanzenden Tone, um welchen der Himmel wellt, durch schmale, schmachtende Spalten in die alten Abgründe ohne Ende fällt... ",12.1.1900,Berlin-Schmargendorf
270,06b017,Gebet,"Nacht, stille Nacht, in die verwoben sind ganz weiße Dinge, rote, bunte Dinge, verstreute Farben, die erhoben sind zu Einem Dunkel Einer Stille, - bringe doch mich auch in Beziehung zu dem Vielen, das du erwirbst und überredest. Spielen denn meine Sinne noch zu sehr mit Licht? Würde sich denn mein Angesicht noch immer störend von den Gegenständen abheben? Urteile nach meinen Händen: Liegen sie nicht wie Werkzeug da und Ding? Ist nicht der Ring selbst schlicht an meiner Hand, und liegt das Licht nicht ganz so, voll Vertrauen, über ihnen, - als ob sie Wege wären, die, beschienen, nicht anders sich verzweigen, als im Dunkel?... ",13.12.1900,Berlin-Schmargendorf
271,06b018,Fortschritt,"Und wieder rauscht mein tiefes Leben lauter, als ob es jetzt in breitern Ufern ginge. Immer verwandter werden mir die Dinge und alle Bilder immer angeschauter. Dem Namenlosen fühl ich mich vertrauter: Mit meinen Sinnen, wie mit Vögeln, reiche ich in die windigen Himmel aus der Eiche, und in den abgebrochnen Tag der Teiche sinkt, wie auf Fischen stehend, mein Gefühl. ",27.9.1900,Worpswede
272,06b019,Vorgefühl,"Ich bin wie eine Fahne von Fernen umgeben. Ich ahne die Winde, die kommen, und muss sie leben, während die Dinge unten sich noch nicht rühren: die Türen schließen noch sanft, und in den Kaminen ist Stille; die Fenster zittern noch nicht, und der Staub ist noch schwer. Da weiß ich die Stürme schon und bin erregt wie das Meer. Und breite mich aus und falle in mich hinein und werfe mich ab und bin ganz allein in dem großen Sturm. ",Herbst 1904?,Schweden?
273,06b020,Sturm,"Wenn die Wolken, von Stürmen geschlagen, jagen: Himmel von hundert Tagen über einem einzigen Tag -: Dann fühl ich dich, Hetman, von fern (der du deine Kosaken gern zu dem größesten Herrn führen wolltest). Deinen waagrechten Nacken fühl ich, Mazeppa. Dann bin auch ich an das rasende Rennen eines rauchenden Rückens gebunden; alle Dinge sind mir verschwunden, nur die Himmel kann ich erkennen: Überdunkelt und überschienen lieg ich flach unter ihnen, wie Ebenen liegen; meine Augen sind offen wie Teiche, und in ihnen flüchtet das gleiche Fliegen. ",wohl Herbst 1904,Schweden
274,06b021,Abend in Skåne,"Der Park ist hoch. Und wie aus einem Haus tret ich aus seiner Dämmerung heraus in Ebene und Abend. In den Wind, denselben Wind, den auch die Wolken fühlen, die hellen Flüsse und die Flügelmühlen, die langsam mahlend stehn am Himmelsrand. Jetzt bin auch ich ein Ding in seiner Hand, das kleinste unter diesen Himmeln. - Schau: Ist das Ein Himmel?:                       Selig lichtes Blau, in das sich immer reinere Wolken drängen, Und drunter alle Weiß in Übergängen, und drüber jenes dünne, große Grau, warmwallend wie auf roter Untermalung, und über allem diese stille Strahlung sinkender Sonne.                        Wunderlicher Bau,in sich bewegt und von sich selbst gehalten, Gestalten bildend, Riesenflügel, Falten und Hochgebirge vor den ersten Sternen und plötzlich, da: ein Tor in solche Fernen, wie sie vielleicht mir Vögel kennen... ",um den 1.11.1904,Jonsered bei Göteborg
275,06b022,Abend,"Der Abend wechselt langsam die Gewänder, die ihm ein Rand von alten Bäumen hält; du schaust: und von dir scheiden sich die Länder, ein himmelfahrendes und eins, das fällt; und lassen dich, zu keinem ganz gehörend, nicht ganz so dunkel wie das Haus, das schweigt, nicht ganz so sicher Ewiges beschwörend wie das, was Stern wird jede Nacht und steigt - und lassen dir (unsäglich zu entwirrn) dein Leben bang und riesenhaft und reifend, so dass es, bald begrenzt und bald begreifend, abwechselnd Stein in dir wird und Gestirn. ",Herbst 1904?,Schweden?
276,06b023,Ernste Stunde,"Wer jetzt weint irgendwo in der Welt,             ohne Grund weint in der Welt,             weint über mich. Wer jetzt lacht irgendwo in der Nacht,             ohne Grund lacht in der Nacht,             lacht mich aus. Wer jetzt geht irgendwo in der Welt,             ohne Grund geht in der Welt,             geht zu mir. Wer jetzt stirbt irgendwo in der Welt,             ohne Grund stirbt in der Welt:             sieht mich an. ",Mitte Oktober 1900,Berlin-Schmargendorf
277,06b024,Strophen,"Ist einer, der nimmt alle in die Hand, dass sie wie Sand durch seine Finger rinnen. Er wählt die schönsten aus den Königinnen und lässt sie sich in weißen Marmor hauen, still liegend in des Mantels Melodie; und legt die Könige zu ihren Frauen, gebildet aus dem gleichen Stein wie sie. Ist einer, der nimmt alle in die Hand, dass sie wie schlechte Klingen sind und brechen. Er ist kein Fremder, denn er wohnt im Blut, das unser Leben ist und rauscht und ruht. Ich kann nicht glauben, dass er Unrecht tut; doch hör ich viele Böses von ihm sprechen. ",zwischen 1900-02,?
278,06c001,Initiale,"Gieb deine Schönheit immer hin ohne Rechnen und Reden. Du schweigst. Sie sagt für dich: Ich bin. Und kommt in tausendfachem Sinn, kommt endlich über jeden. ",14.7.1899,Berlin-Schmargendorf
279,06c002,Verkündigung,"Die Worte des EngelsDu bist nicht näher an Gott als wir; wir sind ihm alle weit. Aber wunderbar sind dir die Hände benedeit. So reifen sie bei keiner Frau, so schimmernd aus dem Saum: ich bin der Tag, ich bin der Tau, du aber bist der Baum. Ich bin jetzt matt, mein Weg war weit, vergieb mir, ich vergaß, was Er, der groß in Goldgeschmeid wie in der Sonne saß, dir künden ließ, du Sinnende, (verwirrt hat mich der Raum). Sieh: ich bin das Beginnende, du aber bist der Baum. Ich spannte meine Schwingen aus und wurde seltsam weit; jetzt überfließt dein kleines Haus von meinem großen Kleid. Und dennoch bist du so allein wie nie und schaust mich kaum; das macht: ich bin ein Hauch im Hain, du aber bist der Baum. Die Engel alle bangen so, lassen einander los: noch nie war das Verlangen so, so ungewiss und groß. Vielleicht, dass Etwas bald geschieht, das du im Traum begreifst. Gegrüßt sei, meine Seele sieht: du bist bereit und reifst. Du bist ein großes, hohes Tor, und aufgehn wirst du bald. Du, meines Liedes liebstes Ohr, jetzt fühle ich: mein Wort verlor sich in dir wie im Wald. So kam ich und vollendete dir tausendeinen Traum. Gott sah mich an; er blendete... Du aber bist der Baum. ",21.7.1899,Berlin-Schmargendorf
280,06c003,Die Heiligen drei Könige,"Legende Einst als am Saum der Wüsten sich auftat die Hand des Herrn wie eine Frucht, die sommerlich verkündet ihren Kern, da war ein Wunder: Fern erkannten und begrüßten sich drei Könige und ein Stern. Drei Könige von Unterwegs und der Stern Überall, die zogen alle (überlegs!) so rechts ein Rex und links ein Rex zu einem stillen Stall. Was brachten die nicht alles mit zum Stall von Bethlehem! Weithin erklirrte jeder Schritt, und der auf einem Rappen ritt, saß samten und bequem. Und der zu seiner Rechten ging, der war ein goldner Mann, und der zu seiner Linken fing mit Schwung und Schwing und Klang und Kling aus einem runden Silberding, das wiegend und in Ringen hing, ganz blau zu rauchen an. Da lachte der Stern Überall so seltsam über sie, und lief voraus und stand am Stall und sagte zu Marie: Da bring ich eine Wanderschaft aus vieler Fremde her. Drei Könige mit magenkraft*, von Gold und Topas schwer und dunkel, tumb und heidenhaft, - erschrick mir nicht zu sehr. Sie haben alle drei zuhaus zwölf Töchter, keinen Sohn, so bitten sie sich deinen aus als Sonne ihres Himmelblaus und Trost für ihren Thron. Doch musst du nicht gleich glauben: bloß ein Funkelfürst und Heidenscheich sei deines Sohnes Los. Bedenk, der Weg ist groß. Sie wandern lange, Hirten gleich, inzwischen fällt ihr reifes Reich weiß Gott wem in den Schoß. Und während hier, wie Westwind warm, der Ochs ihr Ohr umschnaubt, sind sie vielleicht schon alle arm und so wie ohne Haupt. Drum mach mit deinem Lächeln licht die Wirrnis, die sie sind, und wende du dein Angesicht nach Aufgang und dein Kind; dort liegt in blauen Linien, was jeder dir verließ: Smaragda und Rubinien und die Tale von Türkis. * mittelhochdeutsch: >Macht< (RMR.)",23.7.1899,Berlin-Schmargendorf
